Process, Fulfillment, Goods, Resume
Process, Fulfillment, Goods, Start
Process, Fulfillment, Goods, Start
Process, Fulfillment, Order, Billing, Complete
Process, Fulfillment, Order, Goods, Complete
Process, Fulfillment, Order, Service, Complete
Process, Fulfillment, Order, Total, Complete
Process, Fulfillment, Order, Work, Complete
Process, Fulfillment, Order, Work, Resume
Process, Fulfillment, Previous, Check
Process, Fulfillment, Service, Added, Value, Complete
Process, Fulfillment, Service, Added, Value, Finalise
Process, Fulfillment, Service, Added, Value, Resume
Process, Fulfillment, Service, Added, Value, Start
Process, Fulfillment, Service, Added, Value, Start
Process, Fulfillment, Service, Finalise
Process, Fulfillment, Service, Resume
Process, Fulfillment, Service, Start
Process, Fulfillment, Total, Finalise
Process, Fulfillment, Total, Resume
Process, Fulfillment, Work, Finalise
Process, Fulfillment, Work, Start
Process, Fulfillment, Work, Start
Process, Goods, Resume
Process, Handler, Event, Completion, Post, Reach, Open
Process, Ignored, Response, Check
Process, Item, Order, In, Features, Locate
Process, Item, Order, Supplier, Update
Process, Items, Order, Sort
Process, Message, Trace, Log
Process, Model, Master, Restart
Process, Models, State, Filter
Process, Null
Process, Null
Process, Null
Process, Null
Process, Order, Amend, Start
Process, Order, Amend, Store
Process, Order, Amendment
Process, Order, Amendment
Process, Order, Amendment
Process, Order, Chain
Process, Order, Create
Process, Order, Create
Process, Order, Delayed, Start
Process, Order, Fail, Billing
Process, Order, Fail, Fulfillment
Process, Order, Fail, Goods
Process, Order, Fail, Service, Added, Value
Process, Order, Fail, Work
Process, Order, In, Item, Order, Locate
Process, Order, Recover, Start
Process, Order, Restart
Process, Order, Start
Process, Order, Start
Process, Order, Start, And, Create
Process, Order, Start, And, Create
Process, Order, Start, And, Create
Process, Order, Start, And, Create
Process, Order, Supplier, Back, Roll
Process, Order, Supplier, Back, Roll
Process, Order, Supplier, Back, Roll
Process, Order, Supplier, Update
Process, Order, Validate
Process, Order, Work, Resume
Process, Products, PPV, Identify
Process, Progression, Identify
Process, Progression, Identify
Process, Properties, Event, Update
Process, Properties, From, Condition, Set
Process, Receipt, Status, Send
Process, Received, Exception
Process, Received, Exception, CISP
Process, Received, Exception, Service
Process, Received, Response
Process, Received, Response
Process, Received, Response
Process, Received, Response
Process, Received, Response, On, Based, Condition, Set
Process, Response, Check, Card, Accept
Process, Response, Order, Amendment
Process, Result, Check, Card, Finalise
Process, Result, Check, Card, Update
Process, Retry, CISP
Process, Service, Added, Value, Resume
Process, Service, Resume
Process, State, Fulfillment, Finalise
Process, State, Order, Amendment, Check
Process, State, Order, Amendment, Check
Process, State, Order, Child, From, Map, Order, Fulfillment, Update
Process, State, Parked, Existing, Check
Process, States, Order, Amendment, Check
Process, Status, Order, Amend, Child, Check
Process, Status, Order, Amendment, Goods, Publish
Process, Status, Order, Amendment, Service, Added, Value, Publish
Process, Status, Order, Amendment, Service, Publish
Process, Status, Order, Amendment, Total, Publish
Process, Status, Order, Child, Check
Process, Status, Order, Interim, Generate
Process, Status, Order, Interim, Suppress, Set
Process, Stub, Credential, SIP, Encrypt
Process, Time, Date, Timeout, Calculate
Process, Time, Date, Timeout, Calculate
Process, Timeout, From, Key, State, Order, Get
Process, Timer, Cancel
Process, Timer, Existing, Check
Process, Timer, Start
Process, Total, Resume
Process, Trees, Root, Order, Sales, Rollback
Process, Updated, Feature, Supplier
Process, Values, Attribute, Order, Update
Products, All, Fulfill
Products, Associated, Get
Products, Get
Products, Related, Configure
Products, Root, Configure
Property, On, Based, Feature, Set
Property, On, Based, Feature, Supplier, set
Provide, Cease, Supplier, Purge
Received, Response, Exception, BTWSTAA
Registry, Model
Report, Generate
Reporter, Activity, JMS
Selection
Servlet, PMF
Servlet, Polling
State, And, Id, Order, Client, Id, Client, With, States, Order, Goods, Query
State, And, Id, Order, Client, Id, Client, With, States, Order, Service, Query
State, And, Stamp, Time, Creation, With, Order, Fulfillment, Query
State, Encoded
State, Model, Nested
Store, Password
Supplier, For, Process, Features, Sales, Set
Tactical, Nelson
Task, Timer, Test
Test, ofs_prov_no
Tool, Report, GC
Transport, HTTP
Transport, JMS
Type, And, ID, Order, Client, With, Entrys, Fulfillment, Query
Type, And, Key, Order, Child, With, Entrys, Fulfillment, Query
Type, And, Key, Order, Fulfillment, With, Entrys, Fulfillment, Query
Update, Features, Supplier, Gen, PMF
V1_3, Impl, Handler, File, GC
Value, Account, Goods
Value, Account, Total
Value, Applicability, Feature, Product
Value, Association, Feature, Product, Add
Value, Association, Feature, Product, Change
Value, Association, Feature, Product, Delete
Value, Association, Feature, Product, Unchanged
Value, Association, Product, Add
Value, Association, Product, Change
Value, Association, Product, Delete
Value, Association, Product, Unchanged
Value, Dependency, Feature, Product
Value, Dependency, Product
Value, Incompatibility, Feature, Product
Value, Inheritence, Product
Value, Map, Item, Order, Fulfillment
Value, Message, Error, Order, Billing
Viewer, Model
Viewer, Report
Viewer, XML
Wrapper, JMS

----------
Max length: 13
ID, Catalog, And, ID, Supplier, Type, Key, Order, Fulfillment, With, Entrys, Fulfillment, Query

Process finished with exit code 0
