ALL, Credentials, SIP, Query
Action, Cancel, KCI, Bulk, Inject
Action, Cancel, KCI, Single, Inject
Action, Compress
Action, Control, Interface
Action, Control, Manual
Action, Control, Mode
Action, Display, File, Status, Daily
Action, Entity, View
Action, Event, External, Inject
Action, File
Action, File, Display
Action, Files
Action, Global, Identify
Action, HDM
Action, KCI28, Single, Inject
Action, KCI3, Bulk, Inject
Action, KCI3, Single, Inject
Action, List, Link, Report, Database
Action, Manual, Daily
Action, Order, Fail
Action, Order, Restart
Action, Order, Resume
Action, Registry, Reload
Action, Report, Database
Action, Resubmit
Action, Save
Action, Save, Status
Action, Status
Action, Store, And, Upload
Action, Success
Action, Table, Report, Database
Action, Validation, Interface
Adapter, Bean, JVT, Account, Billing
Adapter, Bean, JVT, Account, Service
Adapter, Bean, JVT, Address
Adapter, Bean, JVT, Agent, Team, Sales
Adapter, Bean, JVT, Appointment
Adapter, Bean, JVT, Attribute, Entity, State, Order
Adapter, Bean, JVT, Attribute, Order, Billing
Adapter, Bean, JVT, Attribute, Order, Fulfillment
Adapter, Bean, JVT, Attribute, Order, Goods
Adapter, Bean, JVT, Attribute, Order, Service
Adapter, Bean, JVT, Attribute, Order, Total
Adapter, Bean, JVT, Change, State, Order
Adapter, Bean, JVT, Check, Card
Adapter, Bean, JVT, Contact, Roled, Item, Order, Billing
Adapter, Bean, JVT, Contact, Roled, Item, Order, Fulfillment
Adapter, Bean, JVT, Contact, Roled, Item, Order, Goods
Adapter, Bean, JVT, Contact, Roled, Item, Order, Service
Adapter, Bean, JVT, Contact, Roled, Item, Order, Total
Adapter, Bean, JVT, Control, Interface
Adapter, Bean, JVT, Credentials, SIP
Adapter, Bean, JVT, Entity, State, Order, Billing, Locking
Adapter, Bean, JVT, Entity, State, Order, Goods, Locking
Adapter, Bean, JVT, Entity, State, Order, Locking
Adapter, Bean, JVT, Entity, State, Order, Service, Locking
Adapter, Bean, JVT, Entity, State, Order, Total, Locking
Adapter, Bean, JVT, Entry, Fulfillment
Adapter, Bean, JVT, Feature, Item, Order, Billing
Adapter, Bean, JVT, Feature, Item, Order, Fulfillment
Adapter, Bean, JVT, Feature, Item, Order, Goods
Adapter, Bean, JVT, Feature, Item, Order, Service
Adapter, Bean, JVT, Feature, Item, Order, Total
Adapter, Bean, JVT, File, BASOL
Adapter, Bean, JVT, Impairment
Adapter, Bean, JVT, Info, Timer
Adapter, Bean, JVT, Instructions, Payment
Adapter, Bean, JVT, Item, Order, Billing
Adapter, Bean, JVT, Item, Order, Fulfillment
Adapter, Bean, JVT, Item, Order, Goods
Adapter, Bean, JVT, Item, Order, Service
Adapter, Bean, JVT, Item, Order, Total
Adapter, Bean, JVT, Map, Order, Fulfillment
Adapter, Bean, JVT, Mapping, SSN
Adapter, Bean, JVT, Note, Item, Order, Billing
Adapter, Bean, JVT, Note, Item, Order, Fulfillment
Adapter, Bean, JVT, Note, Item, Order, Goods
Adapter, Bean, JVT, Note, Item, Order, Service
Adapter, Bean, JVT, Note, Item, Order, Total
Adapter, Bean, JVT, Order, Billing
Adapter, Bean, JVT, Order, Fulfillment
Adapter, Bean, JVT, Order, Goods
Adapter, Bean, JVT, Order, Service
Adapter, Bean, JVT, Order, Total
Adapter, Bean, JVT, Party
Adapter, Bean, JVT, Point, Service
Adapter, Bean, JVT, Requests, Disable, Interface
All, Info, Timer, Query
Archiver
Association, Fulfillment, Add
Associations, Fulfillment, Remove
Attribute, As, State, Store
Attributes, Get
Bean, Account, Billing
Bean, Account, Service
Bean, Address, Name
Bean, Agent, Team, Sales
Bean, Appointment
Bean, Attribute, Entity, State, Order
Bean, Attribute, Order, Billing
Bean, Attribute, Order, Fulfillment
Bean, Attribute, Order, Goods
Bean, Attribute, Order, Service
Bean, Attribute, Order, Total
Bean, Change, State, Order
Bean, Check, Card
Bean, Config, Ofs
Bean, Contact, Roled, Item, Order, Billing
Bean, Contact, Roled, Item, Order, Fulfillment
Bean, Contact, Roled, Item, Order, Goods
Bean, Contact, Roled, Item, Order, Service
Bean, Contact, Roled, Item, Order, Total
Bean, Control, Interface
Bean, Control, Registry
Bean, Controller, BOCFSM
Bean, Controller, Component
Bean, Controller, Event, Incoming
Bean, Controller, Event, Outgoing
Bean, Controller, FOCFSM
Bean, Controller, GOCFSM
Bean, Controller, PMF
Bean, Controller, SOCFSM
Bean, Controller, TOCFSM
Bean, Credentials, SIP
Bean, Data, Archive
Bean, Entity, State, Order, Billing, Locking
Bean, Entity, State, Order, Goods, Locking
Bean, Entity, State, Order, Locking
Bean, Entity, State, Order, Service, Locking
Bean, Entity, State, Order, Total, Locking
Bean, Entry, Fulfillment
Bean, Feature, Item, Order, Billing
Bean, Feature, Item, Order, Fulfillment
Bean, Feature, Item, Order, Goods
Bean, Feature, Item, Order, Service
Bean, Feature, Item, Order, Total
Bean, File, BASOL
Bean, Impairment
Bean, Info, Timer
Bean, Instructions, Payment
Bean, Item, Order, Billing
Bean, Item, Order, Fulfillment
Bean, Item, Order, Goods
Bean, Item, Order, Service
Bean, Item, Order, Total
Bean, Management, Product
Bean, Manager, Entity
Bean, Manager, Timer, Polling
Bean, Map, Item, Order, Fulfillment
Bean, Map, Order, Fulfillment
Bean, Mapping, SSN
Bean, Note, Item, Order, Billing
Bean, Note, Item, Order, Fulfillment
Bean, Note, Item, Order, Goods
Bean, Note, Item, Order, Service
Bean, Note, Item, Order, Total
Bean, Object, Storing
Bean, Order, Billing
Bean, Order, Fail
Bean, Order, Fulfillment
Bean, Order, Goods
Bean, Order, Restart
Bean, Order, Resubmit
Bean, Order, Resume
Bean, Order, Service
Bean, Order, Total
Bean, Order, View
Bean, Party
Bean, Point, Service
Bean, Publisher
Bean, Registry, Reload
Bean, Reports, Daily
Bean, Requests, Disable, Interface
Bean, Session, Entity, State, Order, JVT
Bean, Session, Order, Billing, JVT
Bean, Session, Order, Fulfillment, JVT
Bean, Session, Order, Goods, JVT
Bean, Session, Order, Service, JVT
Bean, Session, Order, Total, JVT
Bean, Subscriber, APIGEEIC
Bean, Subscriber, APIGEEOC
Bean, Subscriber, APIGWBOBIC
Bean, Subscriber, APIGWBOBOC
Bean, Subscriber, APIGWMPACCSIC
Bean, Subscriber, APIGWMPACCSOC
Bean, Subscriber, ASCIC
Bean, Subscriber, ASCOC
Bean, Subscriber, BBVOSSIC
Bean, Subscriber, BBVOSSOC
Bean, Subscriber, BOC
Bean, Subscriber, CIC
Bean, Subscriber, COC
Bean, Subscriber, DNPIC
Bean, Subscriber, DNPOC
Bean, Subscriber, ESBMCCIC
Bean, Subscriber, ESBMCCOC
Bean, Subscriber, ESBMPAIC
Bean, Subscriber, ESBMPAOC
Bean, Subscriber, ESBMUPIC
Bean, Subscriber, ESBMUPOC
Bean, Subscriber, ESBNAQIC
Bean, Subscriber, ESBNAQOC
Bean, Subscriber, Event, Call, Method
Bean, Subscriber, Event, Change, State, Order
Bean, Subscriber, Event, Error
Bean, Subscriber, FOC
Bean, Subscriber, GOC
Bean, Subscriber, Generic
Bean, Subscriber, IC, Sentry, OR
Bean, Subscriber, IIPMMDSIC
Bean, Subscriber, IIPMMDSOC
Bean, Subscriber, IIPMNSIC
Bean, Subscriber, IIPMNSOC
Bean, Subscriber, IIPMPACCSIC
Bean, Subscriber, IIPMPACCSOC
Bean, Subscriber, IIPMTPSIC
Bean, Subscriber, IIPMTPSOC
Bean, Subscriber, IIPNETGEMIC
Bean, Subscriber, IIPNETGEMOC
Bean, Subscriber, IIPORCSIC
Bean, Subscriber, IIPORCSOC
Bean, Subscriber, In, Sales, V
Bean, Subscriber, In, Supp, V
Bean, Subscriber, Input, MQ_
Bean, Subscriber, Input, Order, Sales, Siebel, One
Bean, Subscriber, Input, Order, Sales, View, One
Bean, Subscriber, Input, Order, Service, Reach, Open
Bean, Subscriber, Input, Order, Work, Siebel, One
Bean, Subscriber, Input, Order, Work, View, One
Bean, Subscriber, Input, PMF
Bean, Subscriber, Input, Response, CISP, Retail
Bean, Subscriber, MNMIC
Bean, Subscriber, MNMOC
Bean, Subscriber, MSEOIC
Bean, Subscriber, MSEOOC
Bean, Subscriber, OC, Sentry, OR
Bean, Subscriber, OSSIC, Nev
Bean, Subscriber, OSSOC, Nev
Bean, Subscriber, Out, Sales, V
Bean, Subscriber, Out, Supp, V
Bean, Subscriber, Output, Order, Sales, Siebel, One
Bean, Subscriber, Output, Order, Sales, View, One
Bean, Subscriber, Output, Order, Service, Reach, Open
Bean, Subscriber, Output, Order, Work, Siebel, One
Bean, Subscriber, Output, Order, Work, View, One
Bean, Subscriber, Output, PMF
Bean, Subscriber, Output, Request, CISP, Retail
Bean, Subscriber, PMF, MQ_
Bean, Subscriber, RBSCIC
Bean, Subscriber, RBSCOC
Bean, Subscriber, RIC
Bean, Subscriber, ROC
Bean, Subscriber, SASIC
Bean, Subscriber, SASOC
Bean, Subscriber, SOC
Bean, Subscriber, TOC
Bean, Subscriber, TSGIC
Bean, Subscriber, TSGOC
Bean, Table, Control, Interface
Client, Control, Interface
Client, Orders, Outstanding
Client, Queue
Client, Registry, Reload
Client, Reports, Daily
Client, Transform
Comparator, Value, Item, Order
Condition, As, Attribute, Retrieve
Config, Logging, SI
Contains
Data, User, By, Info, Timer, Query
Date, Current, Initialise
Dependency, Process
Descriptor, Property, Event, AAERAE, Service
Descriptor, Property, Event, BTWSTAA
Descriptor, Property, Event, CISP
Descriptor, Property, Event, Call, Method
Descriptor, Property, Event, External
Descriptor, Property, Event, Fulfillment
Descriptor, Property, Event, Order, Goods
Descriptor, Property, Event, Order, Service
Descriptor, Property, Event, Payment
Descriptor, Property, Event, Request, Product
Descriptor, Property, Event, Response, Product
Descriptor, Property, Event, Vitria
Document, Errors, Generate
Encoder, State, Model
Entry, Constant
Entry, Fulfillment, Locate
Event, Accepted, Order, Billing, Amendment
Event, Accepted, Partial, Order, Billing, Amendment
Event, External, Insert
Event, Intermediate, Fulfillment, Work
Event, Order, Fulfillment, Abort
Event, Rejected, Order, Billing, Amendment
Event, Request, Service, ADSL
Event, Response, Order, Billing, Insert
Event, Response, Order, Total, Insert
Event, Response, Service, ADSL
Exception, Polling
Executor, Jdbc
Expired, By, Info, Timer, Query
Externaliser, Event, Change, Status, Order
Externaliser, Number, Activate, Port, AIB
Externaliser, Order, Billing
Externaliser, Order, Fulfillment, AIB
Externaliser, Order, Fulfillment, Siebel, One
Externaliser, Order, Fulfillment, View, One
Externaliser, Order, Goods
Externaliser, Order, Service
Externaliser, Order, Total
Externaliser, Output, Order, Sales, BTOBSG
Externaliser, Request, Check, Card
Externaliser, Request, Order, BALMBOC
Externaliser, Request, Order, BALMFR
Externaliser, Request, Order, Billing, BAL
Externaliser, Request, Order, CISP, Retail
Externaliser, Request, Order, FVA, Reach, Open
Externaliser, Request, Order, Goods, ASC
Externaliser, Request, Order, Goods, ESBMSC
Externaliser, Request, Order, MSEO
Externaliser, Request, Order, RCFCR, Reach, Open
Externaliser, Request, Order, SBS, Reach, Open
Externaliser, Request, Order, Service, APIGEE
Externaliser, Request, Order, Service, APIGWBOB
Externaliser, Request, Order, Service, APIGWMPACCS
Externaliser, Request, Order, Service, BAFTA
Externaliser, Request, Order, Service, BC, Ww, BT
Externaliser, Request, Order, Service, CMI
Externaliser, Request, Order, Service, DNP
Externaliser, Request, Order, Service, ESBMCC
Externaliser, Request, Order, Service, ESBMHHS
Externaliser, Request, Order, Service, ESBMIF
Externaliser, Request, Order, Service, ESBMMD
Externaliser, Request, Order, Service, ESBMPA
Externaliser, Request, Order, Service, ESBMSS
Externaliser, Request, Order, Service, ESBMUP
Externaliser, Request, Order, Service, ESBNAQ
Externaliser, Request, Order, Service, ESBORDSSRM
Externaliser, Request, Order, Service, FLOW
Externaliser, Request, Order, Service, IIPMAL
Externaliser, Request, Order, Service, IIPMMDS
Externaliser, Request, Order, Service, IIPMNS
Externaliser, Request, Order, Service, IIPMPACCS
Externaliser, Request, Order, Service, IIPMTPC
Externaliser, Request, Order, Service, IIPMTPS
Externaliser, Request, Order, Service, IIPNETGEM
Externaliser, Request, Order, Service, IIPORCS
Externaliser, Request, Order, Service, ISDN
Externaliser, Request, Order, Service, ISDN2e
Externaliser, Request, Order, Service, KCIM
Externaliser, Request, Order, Service, MCSO
Externaliser, Request, Order, Service, MDD
Externaliser, Request, Order, Service, MET
Externaliser, Request, Order, Service, METB
Externaliser, Request, Order, Service, MNM
Externaliser, Request, Order, Service, MNP
Externaliser, Request, Order, Service, MNUM
Externaliser, Request, Order, Service, MTPA
Externaliser, Request, Order, Service, OSCAR
Externaliser, Request, Order, Service, RBSC
Externaliser, Request, Order, Service, SAS
Externaliser, Request, Order, Service, Sentry, OR
Externaliser, Request, Order, Service, TSG
Externaliser, Request, Order, Service, UESCD
Externaliser, Request, Order, Total, AIB
Externaliser, Request, Order, Work
Externaliser, Request, Service, Added, Value, BTWSTAA
Externaliser, Request, Service, BBVOSS
Externaliser, Request, Service, CISP
Externaliser, Request, Service, OSS, Nev, BT
Externaliser, Request, Service, RIOSS
Externaliser, Response, Order, Fulfillment
Externaliser, Response, PMF
Features, Get
Features, Product, Add
File, Compress
File, Plain
Form, KCI3, Bulk, Inject
Form, Validation, Interface
Formatter, Csv
Formatter, Html
Formatter, Width, Fixed
Formatter, XML
Fulfillment, Select
Hierarchy, Target, Attach
History, State, Order
Home, Controller, Component
Home, Controller, Event, Incoming
Home, Controller, Event, Outgoing
Home, Controller, FSM
Home, Controller, PMF
Home, Data, Archive
Home, Entity, Stateful
Home, Item, Order
Home, Manager, Timer, Polling
Home, Map, Item, Order, Fulfillment
Home, Order
Home, Order, JVT
Home, Order, Supplier, JVT
Home, Remote, Manager, Entity
ID, Catalog, And, ID, Supplier, Type, Fulfillment, With, Entrys, Fulfillment, Query
ID, Catalog, And, ID, Supplier, Type, Key, Order, Fulfillment, With, Entrys, Fulfillment, Query
ID, Catalog, And, Type, Key, Order, Fulfillment, With, Entrys, Fulfillment, Query
ID, Check, Card, With, Checks, Card, Query
ID, Client, And, Reference, Order, Customer, With, Orders, Fulfillment, Query
ID, Order, Client, Only, With, Orders, Fulfillment, Query
ID, Order, Client, With, Orders, Fulfillment, Query
ID, Order, Supplier, With, Orders, Billing, Query
ID, Order, Supplier, With, Orders, Goods, Query
ID, Order, Supplier, With, Orders, Service, Query
ID, Order, Supplier, With, Orders, Total, Query
ID, Supplier, And, ID, Order, Client, With, Orders, Billing, Query
ID, Supplier, And, ID, Order, Client, With, Orders, Goods, Query
ID, Supplier, And, ID, Order, Client, With, Orders, Service, Query
ID, Supplier, And, ID, Order, Client, With, Orders, Total, Query
ID, Supplier, And, ID, Order, Supplier, With, Orders, Billing, Query
ID, Supplier, And, ID, Order, Supplier, With, Orders, Goods, Query
ID, Supplier, And, ID, Order, Supplier, With, Orders, Service, Query
ID, Supplier, And, ID, Order, Supplier, With, Orders, Total, Query
ID, Supplier, And, Type, Key, Order, Fulfillment, With, Entrys, Fulfillment, Query
Ids, List
Impl, Event, Order, Billing, Amendment
Impl, Event, Order, Billing, Continue
Impl, Factory, Account, Billing
Impl, Factory, Account, Service
Impl, Factory, Agent, Team, Sales
Impl, Factory, Appointment
Impl, Factory, Change, State, Order
Impl, Factory, Control, Interface
Impl, Factory, Credentials, SIP
Impl, Factory, Entity, State, Order
Impl, Factory, Entity, State, Order, Billing
Impl, Factory, Entity, State, Order, Billing, Locking
Impl, Factory, Entity, State, Order, Goods
Impl, Factory, Entity, State, Order, Goods, Locking
Impl, Factory, Entity, State, Order, Locking
Impl, Factory, Entity, State, Order, Service
Impl, Factory, Entity, State, Order, Service, Locking
Impl, Factory, Entity, State, Order, Total
Impl, Factory, Entity, State, Order, Total, Locking
Impl, Factory, Event, Check, Card
Impl, Factory, Event, JMS
Impl, Factory, Event, Machine, State
Impl, Factory, Event, Order, Amendment, Fulfillment
Impl, Factory, Event, Order, Billing
Impl, Factory, Event, Order, Fulfillment
Impl, Factory, Event, Order, General
Impl, Factory, Event, Order, Goods
Impl, Factory, Event, Order, Recovery, Fulfillment
Impl, Factory, Event, Order, Service
Impl, Factory, Event, Order, Total
Impl, Factory, Event, PMF
Impl, Factory, File, BASOL
Impl, Factory, Fulfillment
Impl, Factory, Impairment
Impl, Factory, Info, Timer
Impl, Factory, Mapping, SSN
Impl, Factory, Object, Storing
Impl, Factory, Order, Billing
Impl, Factory, Order, Fulfillment
Impl, Factory, Order, Goods
Impl, Factory, Order, Service
Impl, Factory, Order, Total
Impl, Factory, Party
Impl, Factory, Payment
Impl, Factory, Point, Service
Impl, Factory, Product
Impl, Factory, Requests, Disable, Interface
Impl, Factory, Response, Order
Impl, Factory, Utility
Impl, Key, Attribute, Order
Impl, Key, Contact, Roled, Item, Order
Impl, Key, Feature, Item, Order
Impl, Key, Note, Item, Order
Impl, Manager, Timer, Polling
Impl, Value, Num, Seq, And, Num, Uniq, With, Object, Storing, Query
Impl, Value, Num, Uniq, With, Object, Storing, Query
Impl, Value, Soset, With, Object, Storing, Query
Initialise
Internaliser, Exception, BC, Ww, BT
Internaliser, Exception, Check, Card
Internaliser, Exception, FVA, Reach, Open
Internaliser, Exception, ISDN
Internaliser, Exception, ISDN2e
Internaliser, Exception, Order, BTWSTAA
Internaliser, Exception, Order, Billing
Internaliser, Exception, Order, CISP
Internaliser, Exception, Order, Total
Internaliser, Exception, Reach, Open
Internaliser, Exception, SBS, Openreach
Internaliser, Order, Fulfillment
Internaliser, Order, Fulfillment, AIB
Internaliser, Order, Fulfillment, MCSO
Internaliser, Order, Fulfillment, Siebel, One
Internaliser, Order, Fulfillment, View, One
Internaliser, Request, Order, Sales, BTOBSG
Internaliser, Request, Order, Service, ESBMMD
Internaliser, Request, PMF
Internaliser, Response, Ack, MTPA
Internaliser, Response, Acknowledge, MET
Internaliser, Response, Check, Card
Internaliser, Response, Number, Activate, Port, AIB
Internaliser, Response, Order, BALMBOC
Internaliser, Response, Order, BALMFR
Internaliser, Response, Order, Billing
Internaliser, Response, Order, Billing, BAL
Internaliser, Response, Order, CISP, Retail
Internaliser, Response, Order, FVA, Reach, Open
Internaliser, Response, Order, Goods
Internaliser, Response, Order, Goods, ASC
Internaliser, Response, Order, Goods, ESBMSC
Internaliser, Response, Order, MSEO
Internaliser, Response, Order, SBS, Reach, Open
Internaliser, Response, Order, Service
Internaliser, Response, Order, Service, APIGEE
Internaliser, Response, Order, Service, APIGWBOB
Internaliser, Response, Order, Service, APIGWMPACCS
Internaliser, Response, Order, Service, BAFTA
Internaliser, Response, Order, Service, BC, Ww, BT
Internaliser, Response, Order, Service, DNP
Internaliser, Response, Order, Service, ESBMCC
Internaliser, Response, Order, Service, ESBMHHS
Internaliser, Response, Order, Service, ESBMIF
Internaliser, Response, Order, Service, ESBMPA
Internaliser, Response, Order, Service, ESBMSS
Internaliser, Response, Order, Service, ESBMUP
Internaliser, Response, Order, Service, ESBNAQ
Internaliser, Response, Order, Service, ESBORDSSRM
Internaliser, Response, Order, Service, FLOW
Internaliser, Response, Order, Service, IIPMAL
Internaliser, Response, Order, Service, IIPMMDS
Internaliser, Response, Order, Service, IIPMNS
Internaliser, Response, Order, Service, IIPMPACCS
Internaliser, Response, Order, Service, IIPMTPC
Internaliser, Response, Order, Service, IIPMTPS
Internaliser, Response, Order, Service, IIPNETGEM
Internaliser, Response, Order, Service, ISDN
Internaliser, Response, Order, Service, ISDN2e
Internaliser, Response, Order, Service, KCIM
Internaliser, Response, Order, Service, MCSO
Internaliser, Response, Order, Service, MDD
Internaliser, Response, Order, Service, METB
Internaliser, Response, Order, Service, MNM
Internaliser, Response, Order, Service, MNP
Internaliser, Response, Order, Service, MNUM
Internaliser, Response, Order, Service, MTPA
Internaliser, Response, Order, Service, MTPAQ
Internaliser, Response, Order, Service, OSCAR
Internaliser, Response, Order, Service, RBSC
Internaliser, Response, Order, Service, Reach, Open
Internaliser, Response, Order, Service, SAS
Internaliser, Response, Order, Service, SAT
Internaliser, Response, Order, Service, Sentry, OR
Internaliser, Response, Order, Service, TSG
Internaliser, Response, Order, Service, UESCD
Internaliser, Response, Order, Total
Internaliser, Response, Order, Total, AIB
Internaliser, Response, Order, Work
Internaliser, Response, Service, Added, Value, BTWSTAA
Internaliser, Response, Service, BBVOSS
Internaliser, Response, Service, CISP
Internaliser, Response, Service, OSS, Nev, BT
Internaliser, Response, Service, RIOSS
Internaliser, Response, Update, Order, Service, MET
Internaliser, Result, Check, Card
Inuse, By, Credentials, SIP, Query
Items, Fulfilled, Non, On, Statuses, Update
Items, Response, METB, Process
Iterator, Value, Order
Key, Entity, State, Order, Billing, With, Orders, Billing, Query
Key, Entity, State, Order, Goods, With, Orders, Goods, Query
Key, Entity, State, Order, Service, With, Orders, Service, Query
Key, Entity, State, Order, Total, With, Orders, Total, Query
Key, Entry, Fulfillment, With, Order, Fulfillment, Query
Key, Feature, Previous, With, Feature, Fulfillment, Query
Key, Item, Order
Key, Item, Order, With, Feature, Fulfillment, Query
Key, Map, Item, Order, Fulfillment
Key, Order, Fulfillment, With, Entity, State, Order, Query
Key, Order, Supplier, With, Checks, Card, Query
Key, Order, Supplier, With, Entity, State, Order, Billing, Query
Key, Order, Supplier, With, Entity, State, Order, Goods, Query
Key, Order, Supplier, With, Entity, State, Order, Service, Query
Key, Order, Supplier, With, Entity, State, Order, Total, Query
Key, Order, With, Checks, Card, Query
Key, Order, With, Entry, Fulfillment, Query
List, Event, Encoding, Memory, In
List, Event, Memory, In
Lists, Model, Fulfillment, Resolve
MF, Boolean
MF, Compare
MF, Copy
MF, Date
MF, Function, Path, X
MF, Maths
MF, Table
Mapping, Model, State, Fulfillment, Get
Mapping, Model, State, Supplier, Get
Mappings, Model, State, Fulfillment, Get
Name, Interface, By, Control, Interface, Query
No, Seq, Id, Order, Client, Id, Client, With, Entity, State, Order, Query
Node, Product, Build
Node, Root, Attach
Node, Root, Detach
Number, Serial, SIM, Short, With, Mapping, SSN, Query
Number, Serial, SIM, With, Mapping, SSN, Query
Number, Version, ID, Supplier, ID, Order, Client, With, Orders, Billing, Query
Number, Version, ID, Supplier, ID, Order, Client, With, Orders, Goods, Query
Number, Version, ID, Supplier, ID, Order, Client, With, Orders, Service, Query
Number, Version, ID, Supplier, ID, Order, Client, With, Orders, Total, Query
Order, Restart
Order, Resume
Packager, AIB
Packager, APIGEE
Packager, APIGWBOB
Packager, APIGWMPACCS
Packager, ASC
Packager, B, B2
Packager, BAFTA
Packager, BAL
Packager, BBVOSS
Packager, BTOBSG
Packager, BTWSTAA
Packager, CISP
Packager, CISP, Retail
Packager, CMI
Packager, DNP
Packager, ESBMCC
Packager, ESBMIF
Packager, ESBMMD
Packager, ESBMPA
Packager, ESBMSS
Packager, ESBMUP
Packager, ESBNAQ
Packager, ESBORDSSRM
Packager, FLOW
Packager, FVA, Openreach
Packager, IIPMAL
Packager, IIPMMDS
Packager, IIPMNS
Packager, IIPMPACCS
Packager, IIPMTPC
Packager, IIPMTPS
Packager, IIPNETGEM
Packager, IIPORCS
Packager, ISDN2e
Packager, ISDN30
Packager, KCIM
Packager, MCSO
Packager, MDD
Packager, MET
Packager, METB
Packager, MNM
Packager, MNP
Packager, MNUM
Packager, MSEO
Packager, MTPA
Packager, OSCAR
Packager, OSS, Nev, BT
Packager, PMF
Packager, Port, AIB
Packager, RAP
Packager, RBSC
Packager, RIOSS
Packager, Reach, Open
Packager, SAS
Packager, SAT
Packager, SBS, Openreach
Packager, Sentry, OR
Packager, Siebel, One
Packager, TSG
Packager, UESCD
Packager, View, One
Packager, Vitria
Pair, Target, Source, Fulfill
Process, Attribute, Entity, State, Order, Store
Process, Attribute, Order, Reset
Process, Attributes, Order, Track, Fast, Copy
Process, Based, Access, Attribute
Process, Billing, Resume
Process, Check, Card, Initiate
Process, Code, Product, For, Items, Order, Count
Process, Condition, Based, Feature, Supplier
Process, Condition, Based, Product
Process, Condition, Based, Proposition
Process, Condition, Based, Proposition, Supplier
Process, Condition, Set
Process, Control, Interface
Process, Coordination, Orders, Fulfillment
Process, Database, From, Features, Sales, Set
Process, Entities, State, Order, Amend, And, Check
Process, Entities, State, Order, Create
Process, Entities, State, Order, Resume, And, Check
Process, Entity, From, Key, State, Order, Get
Process, Entity, Read
Process, Entity, Update
Process, Entries, Fulfillment, Query
Process, Entry, Fulfillment, Query
Process, Error, An, Log
Process, Error, Event, Amendment, Log
Process, Error, Fulfillment
Process, Error, Log
Process, Evaluator, Expression, Logical
Process, Event, Change, State, Billing, Generate
Process, Event, Change, State, Fulfillment, Generate
Process, Event, Change, State, Goods, Generate
Process, Event, Change, State, Service, Added, Value, Generate
Process, Event, Change, State, Service, Generate
Process, Event, Change, State, Total, Generate
Process, Event, Change, State, Work, Generate
Process, Event, From, Key, Entry, Fulfillment, Get
Process, Event, From, Key, Order, Get
Process, Event, From, Key, State, Order, Get
Process, Event, From, Order, Get
Process, Event, Intermediate, Billing, Generate
Process, Event, Intermediate, Goods, Generate
Process, Event, Intermediate, Service, Added, Value, Generate
Process, Event, Intermediate, Service, Generate
Process, Event, Intermediate, Total, Generate
Process, Event, Intermediate, Work, Generate
Process, Event, Publish
Process, Event, Status, Amendment, Send
Process, Event, Status, Amendment, Send
Process, Event, Status, Amendment, Send
Process, Exists, Order, Sales
Process, Expired, Order, Work
Process, Feature, Supplier, Persist
Process, Feature, Supplier, Update
Process, Feature, Supplier, Update, MTPA
Process, Feature, Supplier, Update, MTPAQ
Process, Features, Sales, Set
Process, Features, Supplier, Mapped, Refresh
Process, Field, Evaluate
Process, Fulfillment, Billing, Finalise
Process, Fulfillment, Billing, Resume
Process, Fulfillment, Billing, Start
Process, Fulfillment, Billing, Start
Process, Fulfillment, Complete
Process, Fulfillment, Goods, Finalise
